{
  "$schema": "./whats-on.schema.json",
  "meta": {
    "property": "The Rittenhouse Residence",
    "timezone": "America/New_York",
    "generatedAt": "2026-09-01",
    "coverageFrom": "2026-09-01",
    "coverageTo": "2026-11-30",
    "method": "Each entry was read from the organizer's or venue's own page on the date shown in verifiedAt. Tourism round-ups and ticket aggregators were used only as leads, never as the source of a date.",
    "refreshCadence": "weekly",
    "nextVerify": [
      "Xfinity Mobile Arena concerts for September (arena site blocked automated reading on 2026-09-01)",
      "Philadelphia Union home matches (schedule page did not expose dates to automated reading)",
      "Fringe Festival headline shows with Center City venues (listing loads client-side)",
      "Barnes First Friday for October 2 and November 6",
      "Halloween Nights exact 2026 opening night and nights of the week"
    ]
  },
  "sources": [
    { "id": "friends-rittenhouse", "name": "Friends of Rittenhouse Square", "url": "https://www.friendsofrittenhouse.org/events", "kind": "organizer" },
    { "id": "rsq-fine-art", "name": "Rittenhouse Square Fine Art Show", "url": "https://www.rittenhousesquareart.com/", "kind": "organizer" },
    { "id": "rose-squared", "name": "Rose Squared Productions", "url": "https://rosesquared.com/", "kind": "organizer" },
    { "id": "barnes", "name": "Barnes Foundation", "url": "https://www.barnesfoundation.org/whats-on", "kind": "venue" },
    { "id": "ensemble-arts", "name": "Ensemble Arts Philly", "url": "https://www.ensembleartsphilly.org/events-and-tickets", "kind": "venue" },
    { "id": "old-city", "name": "Old City District", "url": "https://www.oldcitydistrict.org/first-friday", "kind": "organizer" },
    { "id": "eagles", "name": "Philadelphia Eagles", "url": "https://www.philadelphiaeagles.com/schedule/", "kind": "organizer" },
    { "id": "ccd", "name": "Center City District", "url": "https://centercityphila.org/explore/upcoming-events/", "kind": "organizer" },
    { "id": "rtm", "name": "Reading Terminal Market", "url": "https://readingterminalmarket.org/events/", "kind": "venue" },
    { "id": "franklin", "name": "The Franklin Institute", "url": "https://fi.edu/en/events-calendar", "kind": "venue" },
    { "id": "drwc", "name": "Delaware River Waterfront Corporation", "url": "https://www.delawareriverwaterfront.com/events", "kind": "organizer" },
    { "id": "fringe", "name": "FringeArts", "url": "https://phillyfringe.org/", "kind": "organizer" },
    { "id": "phila-ose", "name": "City of Philadelphia — Office of Special Events", "url": "https://www.phila.gov/departments/office-of-special-events/events/special-events-calendar/", "kind": "city" },
    { "id": "eastern-state", "name": "Eastern State Penitentiary", "url": "https://www.easternstate.org/halloween", "kind": "venue" },
    { "id": "linc", "name": "Lincoln Financial Field", "url": "https://www.lincolnfinancialfield.com/events/category/concert/", "kind": "venue" },
    { "id": "pfs", "name": "Philadelphia Film Society", "url": "https://filmadelphia.org/festival/", "kind": "organizer" },
    { "id": "marathon", "name": "Philadelphia Marathon", "url": "https://www.philadelphiamarathon.com/", "kind": "organizer" },
    { "id": "sun-papers", "name": "The Sun Newspapers — Phillies 2026 schedule", "url": "https://thesunpapers.com/c/sports/phillies-2026-schedule/", "kind": "press" }
  ],
  "events": [
    { "id": "bruno-mars-linc-2026", "title": "Bruno Mars at the Linc", "start": "2026-09-01", "end": "2026-09-02", "venue": "Lincoln Financial Field", "neighborhood": "South Philadelphia", "category": "music", "note": "Two stadium nights to open the month. Broad Street Line to NRG Station.", "sourceId": "linc", "sourceUrl": "https://www.lincolnfinancialfield.com/events/category/concert/", "verifiedAt": "2026-08-27" },
    { "id": "ccd-fit-zumba-sep-2026", "title": "Center City Fit: Zumba at Dilworth Park", "start": "2026-09-01", "end": "2026-09-29", "time": "Tuesdays 6:00–7:00 PM", "venue": "Dilworth Park", "neighborhood": "Center City", "category": "recurring", "note": "Free outdoor class every Tuesday in September, presented by Rothman Orthopaedics.", "sourceId": "ccd", "sourceUrl": "https://centercityphila.org/explore/upcoming-events/", "verifiedAt": "2026-09-01" },
    { "id": "drwc-friday-jazz-2026", "title": "Friday Night Jazz at Spruce Street Harbor Park", "start": "2026-09-04", "end": "2026-09-25", "time": "Fridays", "venue": "Spruce Street Harbor Park", "neighborhood": "Penn's Landing", "category": "music", "note": "Free riverside jazz series; the 2026 run ends September 25.", "sourceId": "drwc", "sourceUrl": "https://www.delawareriverwaterfront.com/events", "verifiedAt": "2026-09-01" },
    { "id": "drwc-live-local-2026", "title": "Live & Local concerts at Spruce Street Harbor Park", "start": "2026-09-03", "end": "2026-09-24", "time": "Thursdays", "venue": "Spruce Street Harbor Park", "neighborhood": "Penn's Landing", "category": "music", "note": "Free Thursday concert series, closing September 24.", "sourceId": "drwc", "sourceUrl": "https://www.delawareriverwaterfront.com/events", "verifiedAt": "2026-09-01" },
    { "id": "drwc-cosmic-rhythms-2026", "title": "Cosmic Rhythms DJ Nights", "start": "2026-09-05", "end": "2026-09-12", "time": "Saturdays", "venue": "Spruce Street Harbor Park", "neighborhood": "Penn's Landing", "category": "music", "note": "Last two Saturday DJ nights of the season on the waterfront.", "sourceId": "drwc", "sourceUrl": "https://www.delawareriverwaterfront.com/events", "verifiedAt": "2026-09-01" },
    { "id": "drwc-family-fun-2026", "title": "Family Fun Day with PopUpPlay", "start": "2026-09-06", "end": "2026-09-27", "time": "Sundays", "venue": "Spruce Street Harbor Park", "neighborhood": "Penn's Landing", "category": "family", "note": "Free Sunday play sessions through the end of September.", "sourceId": "drwc", "sourceUrl": "https://www.delawareriverwaterfront.com/events", "verifiedAt": "2026-09-01" },
    { "id": "drwc-wellness-2026", "title": "Wellness on the Waterfront", "start": "2026-09-07", "end": "2026-10-12", "venue": "Race Street Pier", "neighborhood": "Old City", "category": "recurring", "note": "Free outdoor fitness sessions under the Ben Franklin Bridge through October 12.", "sourceId": "drwc", "sourceUrl": "https://www.delawareriverwaterfront.com/events", "verifiedAt": "2026-09-01" },
    { "id": "barnes-first-friday-2026-09", "title": "First Friday at the Barnes: pianist Guthrie Ramsey", "start": "2026-09-04", "end": "2026-09-04", "time": "6:00–9:00 PM", "venue": "Barnes Foundation", "neighborhood": "Parkway / Museum District", "category": "museum", "note": "Evening galleries, music, and a bar — a 20-minute walk up the Parkway from the house.", "sourceId": "barnes", "sourceUrl": "https://www.barnesfoundation.org/whats-on", "verifiedAt": "2026-09-01" },
    { "id": "old-city-first-friday-2026-09", "title": "First Friday in Old City", "start": "2026-09-04", "end": "2026-09-04", "time": "Evening; hours vary by gallery", "venue": "Galleries and showrooms across Old City", "neighborhood": "Old City", "category": "arts", "note": "The 30th year of First Friday: new exhibitions, late openings, and the Artist & Artisans Market.", "sourceId": "old-city", "sourceUrl": "https://www.oldcitydistrict.org/first-friday", "verifiedAt": "2026-09-01" },
    { "id": "made-in-philadelphia-summer-market-2026", "title": "Made in Philadelphia Summer Market", "start": "2026-09-04", "end": "2026-09-06", "time": "Fri–Sat 12–8 PM, Sun 12–6 PM", "venue": "Dilworth Park", "neighborhood": "Center City", "category": "market", "note": "50+ local makers at City Hall over Labor Day weekend.", "sourceId": "ccd", "sourceUrl": "https://centercityphila.org/explore/upcoming-events/", "verifiedAt": "2026-09-01" },
    { "id": "phillies-braves-homestand-2026-09", "title": "Phillies vs. Braves homestand", "start": "2026-09-04", "end": "2026-09-07", "venue": "Citizens Bank Park", "neighborhood": "South Philadelphia", "category": "sports", "note": "A Labor Day weekend series that could shape the NL East race.", "sourceId": "sun-papers", "sourceUrl": "https://thesunpapers.com/c/sports/phillies-2026-schedule/", "verifiedAt": "2026-09-01" },
    { "id": "ncc-constitution-signing-2026", "title": "First Signing of the Constitution: 1787", "start": "2026-09-05", "end": "2026-09-05", "time": "11:00 AM–1:00 PM", "venue": "National Constitution Center", "neighborhood": "Old City", "category": "family", "note": "City-permitted commemoration on Independence Mall.", "sourceId": "phila-ose", "sourceUrl": "https://www.phila.gov/departments/office-of-special-events/events/special-events-calendar/", "verifiedAt": "2026-09-01" },
    { "id": "barnes-free-first-sunday-2026-09", "title": "PECO Free First Sunday Family Day at the Barnes", "start": "2026-09-06", "end": "2026-09-06", "time": "10:00 AM–5:00 PM", "venue": "Barnes Foundation", "neighborhood": "Parkway / Museum District", "category": "family", "note": "Free admission all day, with Mexican dance performances this month.", "sourceId": "barnes", "sourceUrl": "https://www.barnesfoundation.org/whats-on", "verifiedAt": "2026-09-01" },
    { "id": "fringe-festival-2026", "title": "Philadelphia Fringe Festival", "start": "2026-09-08", "end": "2026-09-27", "venue": "Venues citywide", "neighborhood": "Citywide", "category": "theater", "note": "Three weeks of independent theater, dance, and immersive work; listings and tickets on the festival site.", "sourceId": "fringe", "sourceUrl": "https://phillyfringe.org/", "verifiedAt": "2026-09-01" },